{
  "schema_version": "1.0.0",
  "activation_id": "SYN-EVE-001",
  "activation_version": "SYN-1.0",
  "principal_ref": "SYN-M5HUM-001",
  "principal_kind": "M5HUM",
  "agent_id": "SYN-M5AGT-001",
  "agent_class": "M5AGT",
  "role": "evidence-review",
  "account_context": "BOM",
  "account_ref": "SYN-BOM-001",
  "compartment_ref": "SYN-PRIVATE-COMPARTMENT",
  "credential": {
    "status": "VALID",
    "evidence_ref": "urn:m5:synthetic:evidence:1",
    "effective_at": "2026-09-23T00:00:00Z",
    "expires_at": "2026-10-23T00:00:00Z"
  },
  "delegation": {
    "status": "VALID",
    "evidence_ref": "urn:m5:synthetic:evidence:1",
    "effective_at": "2026-09-23T00:00:00Z",
    "expires_at": "2026-10-23T00:00:00Z"
  },
  "capability_refs": [
    "M5CAP.PROVENANCE.CONTINUITY.VALIDATE.v1"
  ],
  "provider_classes": [
    "LAYA_LOCAL",
    "JEV_HOSTED"
  ],
  "privacy_mode": "PRIVATE",
  "local_required": false,
  "external_allowed": true,
  "data_domains": [
    "synthetic-review"
  ],
  "namespace_binding_refs": [
    "SYN-NS-NYC"
  ],
  "policy_version": "SYN-POLICY-1",
  "effective_at": "2026-09-23T00:00:00Z",
  "expires_at": "2026-10-23T00:00:00Z",
  "lifecycle_state": "ACTIVE",
  "approval_requirements": [
    "accountable-human"
  ],
  "approval": {
    "status": "VALID",
    "evidence_ref": "urn:m5:synthetic:evidence:1",
    "effective_at": "2026-09-23T00:00:00Z",
    "expires_at": "2026-10-23T00:00:00Z"
  },
  "evidence_refs": [
    "SYN-EVIDENCE"
  ],
  "compatibility": {
    "adapter_revision": "SYN-1.0",
    "m5canon_policy_version": "SYN-1.0",
    "event_contract_version": "1.0.0",
    "meter_version": "1.0.0",
    "reference_catalog_version": "M5-REFERENCE-PRICE-2026-09-v1",
    "settlement_adapter_version": "SYN-1.0",
    "activation_version": "SYN-1.0",
    "runtime_version": "SYN-1.0",
    "api_version": "SYN-1.0",
    "model_family": "SYN-1.0",
    "model_revision": "SYN-1.0",
    "model_artifact_hash": "sha256:0000000000000000000000000000000000000000000000000000000000000000"
  },
  "authority_effect": "DERIVED_BOUNDED_CONTEXT"
}
